Online Dynamic Reordering for Interactive Data Processing,"Bhaskaran Raman, Joseph M. Hellerstein, Vijayshankar Raman",VLDB,1999
A Survey and Critique of Advanced Transaction Models,C. Mohan,SIGMOD Conference,1994
Dynamic Service Matchmaking Among Agents in Open Information Environments,"Matthias Klusch, Katia P. Sycara, Seth Widoff, Jianguo Lu",SIGMOD Conference,1999
A TSQL2 Tutorial,"James Clifford, Ramez Elmasri, Michael D. Soo, Wolfgang Käfer, Nick Kline, Arie Segev, Suryanarayana M. Sripada, Fabio Grandi, John F. Roddick, Richard T. Snodgrass, Christian S. Jensen, Nikos A. Lorentzos, Ilsoo Ahn, Gad Ariav, Don S. Batory, T. Y. Cliff Leung, Curtis E. Dyreson, Krishna G. Kulkarni",SIGMOD Record,1-994
To Table or Not to Table: a Hypertabular Answer,"Giuseppe Santucci, Laura Tarantino",SIGMOD Record,1996
Bitmap Index Design and Evaluation,"Yannis E. Ioannidis, Chee Yong Chan",SIGMOD Conference,1998
The Need for Distributed Asynchronous Transactions,"Lyman Do, Prabhu Ram, Pamela Drew",SIGMOD Conference,1999
Estimating Page Fetches for Index Scans with Finite LRU Buffers,"K. Bernhard Schiefer, Arun N. Swami",VLDB J.,1995
Query Optimization for XML,"Jason McHugh, Jennifer Widom",VLDB,1999
Transactional Information Systems - Book Review,Marc H. Scholl,SIGMOD Record,2001
SHORE: Combining the Best Features of OODBMS and File Systems,Shore Team,SIGMOD Record,1995
Comparing Hierarchical Data in External Memory,Sudarshan S. Chawathe,VLDB,1999
On Computing Correlated Aggregates Over Continual Data Streams,"Divesh Srivastava, Flip Korn, Johannes Gehrke",SIGMOD Conference,2001
The Network is the Database: Data Management for Highly Distributed Systems,"Michael J. Wynblatt, Julio C. Navas",SIGMOD Conference,2001
"Data Management: Lasting Impact of the Wild Wild, Wild, Web",Reed M. Meseck,SIGMOD Record,2001
Join Algorithm Costs Revisited,"Kotagiri Ramamohanarao, Evan P. Harris",VLDB J.,1996
Similarity-Based Queries for Time Series Data,"Alberto O. Mendelzon, Davood Rafiei",SIGMOD Conference,1997
Query Decomposition and View Maintenance for Query Languages for Unstructured Data,Dan Suciu,VLDB,1996
The IDEA Web Lab,"Piero Fraternali, Stefano Paraboschi, Stefano Ceri",SIGMOD Record,1998
On the computation of relational view complements,"Gottfried Vossen, Jens Lechtenbörger",ACM Trans. Database Syst.,2003
Best-effort cache synchronization with source cooperation,"Chris Olston, Jennifer Widom",SIGMOD Conference,2002
Data Integration and Warehousing in Telecom Italia,"Daniele Nardi, Maurizio Lenzerini, Stefano Trisolini",SIGMOD Conference,1999
Journal relevance,Richard T. Snodgrass,SIGMOD Record,2003
Online Scaling in a Highly Available Database,"Svein Erik Bratsberg, Rune Humborstad",VLDB,2001
Improving Timeliness in Real-Time Secure Database Systems,"Sang Hyuk Son, Rasikan David, Bhavani M. Thuraisingham",SIGMOD Record,1996
Storage and Querying of E-Commerce Data,"Yirong Xu, Rakesh Agrawal, Amit Somani",VLDB,2001
The MEDUSA Project: Autonomous Data Management in a Shared-Nothing Parallel Database Machine,"George M. Bryan, J. Geyer, Wayne E. Moore, B. J. Curry, K. W. Lodge",SIGMOD Conference,1994
Hot Block Clustering for Disk Arrays with Dynamic Striping,"Kazuhiko Mogi, Masaru Kitsuregawa",VLDB,1995
Efficient schemes for managing multiversionXML documents,"Shu-Yao Chien, Carlo Zaniolo, Vassilis J. Tsotras",VLDB J.,2002
Concurrency and Recovery for Index Trees,"David B. Lomet, Betty Salzberg",VLDB J.,1997
Efficiently publishing relational data as XML documents,"Bruce G. Lindsay, Hamid Pirahesh, Berthold Reinwald, Michael J. Carey, Rimon Barr, Jayavel Shanmugasundaram, Eugene J. Shekita",VLDB J.,2001
Predator: A Resource for Database Research,Praveen Seshadri,SIGMOD Record,1998
Multi-Dimensional Database Allocation for Parallel Data Warehouses,"Holger Märtens, Erhard Rahm, Thomas Stöhr",VLDB,2000
Fast incremental maintenance of approximate histograms,"Viswanath Poosala, Phillip B. Gibbons, Yossi Matias",ACM Trans. Database Syst.,2002
Lore: A Database Management System for Semistructured Data,"Roy Goldman, Serge Abiteboul, Jennifer Widom, Dallan Quass, Jason McHugh",SIGMOD Record,1997
A Taxonomy for Secure Object-Oriented Databases,"Sebastiaan H. von Solms, Martin S. Olivier",ACM Trans. Database Syst.,1994
High-Concurrency Locking in R-Trees,"Douglas Banks, Marcel Kornacker",VLDB,1-995
A Monte Carlo algorithm for fast projective clustering,"Michael Jones, Pankaj K. Agarwal, T. M. Murali, Cecilia Magdalena Procopiuc",SIGMOD Conference,2002
Updating XML,"Daniel S. Weld, Zachary G. Ives, Igor Tatarinov, Alon Y. Halevy",SIGMOD Conference,2001
Theory of dependence values,Rosa Meo,ACM Trans. Database Syst.,2-000
Dynamic multidimensional histograms,"Piotr Indyk, Sudipto Guha, Nitin Thaper, Nick Koudas",SIGMOD Record,2002
Learning about data integration challenges from day one,Alon Y. Halevy,SIGMOD Record,2003
Hierarchies and Relative Operators in the OLAP Environment,"Maurizio Rafanelli, Elaheh Pourabbas",SIGMOD Conference,2000
High Level Indexing of User-Defined Types,"Brian T. Tran, Jyh-Herng Chow, Michelle Jou, Jean Grandbois, Yun Wang, You-Chin Fuh, Weidong Chen, Nelson Mendonça Mattos",VLDB,1999
Contextualizing the Information Space in Federated Digital Libraries,"Jeroen Hoppenbrouwers, Mike P. Papazoglou",SIGMOD Record,1999
PicoDBMS: Scaling down database techniques for the smartcard,"Patrick Valduriez, Philippe Pucheral, Christophe Bobineau, Luc Bouganim",VLDB J.,2001
Range Queries in OLAP Data Cubes,"Ching-Tien Ho, Rakesh Agrawal, Nimrod Megiddo, Ramakrishnan Srikant",SIGMOD Conference,1-997
An Open Storage System for Abstract Objects,"Lukas Relly, Stephen Blott, Hans-Jörg Schek",SIGMOD Conference,1996
A Data Model and Data Structures for Moving Objects Databases,"Markus Schneider, Enrico Nardelli, Luca Forlizzi, Ralf Hartmut Güting",SIGMOD Record,2000
The XXL search engine: ranked retrieval of XML data using indexes and ontologies,"Anja Theobald, Gerhard Weikum",SIGMOD Record,2002
amdb: An Access Method Debugging Tool,"Joseph M. Hellerstein, Mehul A. Shah, Marcel Kornacker",SIGMOD Record,1998
Aurora: A Data Stream Management System,"Nesime Tatbul, Daniel J. Abadi, C. Erwin, Anurag Maskey, Mitch Cherniack, Alex Rasin, Christian Convey, A. Singer, Eduardo F. Galvez, R. Yan, Ugur Çetintemel, Ying Xing, Stanley B. Zdonik, Michael Stonebraker, Donald Carney, M. Hatoun",SIGMOD Conference,2-003
WWW-UDK: A Web-based Environmental Meta-Information System,"Rudolf Legat, Arne Koschel, Andree Keitel, Ralf Kramer, Claudia Rolker, Ralf Nikolai, Peter C. Lockemann, Konrad Zirm",SIGMOD Record,1997
Operating System Extensions for the Teradata Parallel VLDB,"Sorana Rabinovici, John Catozzi",VLDB,2001
Approximate Computation of Multidimensional Aggregates of Sparse Data Using Wavelets,"Min Wang, Jeffrey Scott Vitter",SIGMOD Record,1999
An Introduction to Spatial Database Systems,Ralf Hartmut Güting,VLDB J.,1-994
How System 11 SQL Server Became Fast,T. K. Rengarajan,VLDB,1996
Deadlock Detection in Distributed Database Systems: A New Algorithm and a Comparative Performance Analysis,"Alfons Kemper, Ehud Gudes, Natalija Krivokapic",VLDB J.,1999
Relational data sharing in peer-based data management systems,"Beng Chin Ooi, Yanfeng Shu, Kian-Lee Tan",SIGMOD Record,2003
Your Mediators Need Data Conversion!,"Sophie Cluet, Katarzyna Smaga, Jérôme Siméon, Claude Delobel",SIGMOD Conference,1998
Efficient similarity search for market basket data,"Alexandros Nanopoulos, Yannis Manolopoulos",VLDB J.,2002
Real Business Processing Meets the Web,James Chong,SIGMOD Conference,1998
A Database Approach to Quality of Service Specification in Video Databases,"Mohand-Said Hacid, Elisa Bertino, Ahmed K. Elmagarmid",SIGMOD Conference,2003
Type-Checking OQL Queries In the ODMG Type Systems,Suad Alagic,ACM Trans. Database Syst.,1999
